{"context_hash":"sha256:ea7792a26f405e2ae9c6f49ca93bbe6076ceac0a1fc53d83426c7d7f2d9377e4","evaluation_manifest_hash":"sha256:f5c275befadcaf024e3de1e7f6b472d5fb020df3649d2b1ba9fdb33b3bd493c5","failure_code":null,"genre_intent_hash":"sha256:0541b4476924bb9c43f946041f38c27e303f43a77e77c2e66ad943a0dd6e65d0","hard_checks":[{"evidence":{"evidence_hash":"sha256:0629dd243871a4d934769de31def08573995a92187a839d6eaf83bb34450e454","inputs":[0],"operator":{"comparator":"ge","kind":"integer_compare","threshold":0},"result":true,"source_bindings":[{"artifact_hash":"sha256:ec29492c496de9074964a5a96adc8ff7d57cc73620399ff027f32bc3d73b1244","artifact_kind":"compile_report","json_pointer":"/search_statistics/chord_query_count","schema_hash":"sha256:76aaba56da4739b30ec7f4efab4e0dc31329daeeb184e15503b0a39d73f9c526"}]},"id":"compile_activity_valid","ordinal":0,"passed":true}],"metrics":[{"available_source_bindings":[],"evidence":null,"id":"distinct_sounding_material_lineage_count","missing_reason":null,"ordinal":0,"value":1},{"available_source_bindings":[],"evidence":null,"id":"genre_similarity","missing_reason":null,"ordinal":1,"value":1},{"available_source_bindings":[],"evidence":null,"id":"material_recurrence_distance_q","missing_reason":null,"ordinal":2,"value":6000},{"available_source_bindings":[],"evidence":null,"id":"native_ji_quality","missing_reason":null,"ordinal":3,"value":1},{"available_source_bindings":[],"evidence":null,"id":"negative_program_structural_item_count","missing_reason":null,"ordinal":4,"value":1},{"available_source_bindings":[],"evidence":null,"id":"section_coverage_q","missing_reason":null,"ordinal":5,"value":1},{"available_source_bindings":[],"evidence":null,"id":"sounding_role_count","missing_reason":null,"ordinal":6,"value":1},{"available_source_bindings":[],"evidence":null,"id":"transformed_recall_count","missing_reason":null,"ordinal":7,"value":1},{"available_source_bindings":[],"evidence":null,"id":"rhythmic_syncopation_q","missing_reason":null,"ordinal":8,"value":0}],"program_hash":"sha256:59511f359dd2c732c5a5b1d3f5e41537c7f74c3fc4982a373ff7ac088f09ee6d","project_hash":"sha256:3c973d5333242b8a46e88c69782bfd8e17e696ccfb2308e589c8267bd0a1fd13","report_hash":"sha256:bc52c54374dffef4a2ba2bac2230edba30c93a0d446a135046df4eb8db1de5b1","request_hash":"sha256:252ce96fcdbd1855ea1ae15777b65b24a76cc577cb75603335d356b2d779c3c3","run_hash":"sha256:acba25512100f80b56fc3ccd14c65be55d94800cda77585c5f41a887e398f9be","schema":"cps.evaluation-report","schema_version":"1.1.0","source_decision_hash":"sha256:bbaab1cde70c2b80c2b238b2047a93eb5c06b1f05314017cb790856be87cbbf0","status":"success"}
