{"context_hash":"sha256:ea7792a26f405e2ae9c6f49ca93bbe6076ceac0a1fc53d83426c7d7f2d9377e4","evaluation_manifest_hash":"sha256:f5c275befadcaf024e3de1e7f6b472d5fb020df3649d2b1ba9fdb33b3bd493c5","failure_code":null,"genre_intent_hash":"sha256:0541b4476924bb9c43f946041f38c27e303f43a77e77c2e66ad943a0dd6e65d0","hard_checks":[{"evidence":{"evidence_hash":"sha256:b769c611410bc0e097bc0be346f96ecbea0c7aeab706f51d796d242795f51b59","inputs":[0],"operator":{"comparator":"ge","kind":"integer_compare","threshold":0},"result":true,"source_bindings":[{"artifact_hash":"sha256:b6efd60b0fb4a991408c52933c9e19de0df16d949b46e3fa96a89ff4ace12329","artifact_kind":"compile_report","json_pointer":"/search_statistics/chord_query_count","schema_hash":"sha256:76aaba56da4739b30ec7f4efab4e0dc31329daeeb184e15503b0a39d73f9c526"}]},"id":"compile_activity_valid","ordinal":0,"passed":true}],"metrics":[{"available_source_bindings":[],"evidence":null,"id":"distinct_sounding_material_lineage_count","missing_reason":null,"ordinal":0,"value":1},{"available_source_bindings":[],"evidence":null,"id":"genre_similarity","missing_reason":null,"ordinal":1,"value":1},{"available_source_bindings":[],"evidence":null,"id":"material_recurrence_distance_q","missing_reason":null,"ordinal":2,"value":4000},{"available_source_bindings":[],"evidence":null,"id":"native_ji_quality","missing_reason":null,"ordinal":3,"value":1},{"available_source_bindings":[],"evidence":null,"id":"negative_program_structural_item_count","missing_reason":null,"ordinal":4,"value":1},{"available_source_bindings":[],"evidence":null,"id":"section_coverage_q","missing_reason":null,"ordinal":5,"value":1},{"available_source_bindings":[],"evidence":null,"id":"sounding_role_count","missing_reason":null,"ordinal":6,"value":1},{"available_source_bindings":[],"evidence":null,"id":"transformed_recall_count","missing_reason":null,"ordinal":7,"value":1},{"available_source_bindings":[],"evidence":null,"id":"rhythmic_syncopation_q","missing_reason":null,"ordinal":8,"value":2000}],"program_hash":"sha256:7c9d586f320b0259b3434f6beaac675abd8a7f379a5fe43bcb13c7b7caa4eed8","project_hash":"sha256:49594fed03cbf0b34af5cb88d80bb17d1488beca8014c7d0078765cf3e8decb1","report_hash":"sha256:f1e764ba5a561a968dde24270fa048c83a30693d3807dc5d19058ac8ae9ea3a2","request_hash":"sha256:3cc3c6130c189335eff6db1558b4c2f6589cd7428c9ff3f87f1cc3b2dfef6cab","run_hash":"sha256:acba25512100f80b56fc3ccd14c65be55d94800cda77585c5f41a887e398f9be","schema":"cps.evaluation-report","schema_version":"1.1.0","source_decision_hash":"sha256:d5d33a9038a3290ddd0c700c6be8d9eeaeceae15da0a1aa6f3192281082c5c63","status":"success"}
