{"context_hash":"sha256:ea7792a26f405e2ae9c6f49ca93bbe6076ceac0a1fc53d83426c7d7f2d9377e4","evaluation_manifest_hash":"sha256:f5c275befadcaf024e3de1e7f6b472d5fb020df3649d2b1ba9fdb33b3bd493c5","failure_code":null,"genre_intent_hash":"sha256:0541b4476924bb9c43f946041f38c27e303f43a77e77c2e66ad943a0dd6e65d0","hard_checks":[{"evidence":{"evidence_hash":"sha256:919c8888896124d8fa47038e5f48806375ebf09955783e214fb0d905f5855fce","inputs":[0],"operator":{"comparator":"ge","kind":"integer_compare","threshold":0},"result":false,"source_bindings":[{"artifact_hash":"sha256:a912be06ae75da6836af46931aea860bff0403dfe42be075746721cf0ffd7c86","artifact_kind":"compile_report","json_pointer":"/search_statistics/chord_query_count","schema_hash":"sha256:76aaba56da4739b30ec7f4efab4e0dc31329daeeb184e15503b0a39d73f9c526"}]},"id":"compile_activity_valid","ordinal":0,"passed":false}],"metrics":[{"available_source_bindings":[],"evidence":null,"id":"distinct_sounding_material_lineage_count","missing_reason":null,"ordinal":0,"value":1},{"available_source_bindings":[],"evidence":null,"id":"genre_similarity","missing_reason":null,"ordinal":1,"value":1},{"available_source_bindings":[],"evidence":null,"id":"material_recurrence_distance_q","missing_reason":null,"ordinal":2,"value":6000},{"available_source_bindings":[],"evidence":null,"id":"native_ji_quality","missing_reason":null,"ordinal":3,"value":1},{"available_source_bindings":[],"evidence":null,"id":"negative_program_structural_item_count","missing_reason":null,"ordinal":4,"value":1},{"available_source_bindings":[],"evidence":null,"id":"section_coverage_q","missing_reason":null,"ordinal":5,"value":1},{"available_source_bindings":[],"evidence":null,"id":"sounding_role_count","missing_reason":null,"ordinal":6,"value":1},{"available_source_bindings":[],"evidence":null,"id":"transformed_recall_count","missing_reason":null,"ordinal":7,"value":0},{"available_source_bindings":[],"evidence":null,"id":"rhythmic_syncopation_q","missing_reason":null,"ordinal":8,"value":4000}],"program_hash":"sha256:e6443c57a5f2df25e2d2b0368936271a6d511003f05cf8ca6e75feb041f34158","project_hash":"sha256:2104f14a11fdebaeed2c8a0fd022266b3dc2e36caf9f44262512dffbdc651581","report_hash":"sha256:aa012959dbb524065fc6a8f81a18a3ab5830ca30ce2b5d4afacb7ff359327a65","request_hash":"sha256:a7e57adb5dede605ceb68843a691b4db3bbb48eb7b500139c37830cd4f876fad","run_hash":"sha256:acba25512100f80b56fc3ccd14c65be55d94800cda77585c5f41a887e398f9be","schema":"cps.evaluation-report","schema_version":"1.1.0","source_decision_hash":"sha256:b7abfe085c5de5491bea3fc35edb0e28d61b3c1c6e92a4c396deef05e9d58bab","status":"success"}
