{"context_hash":"sha256:ea7792a26f405e2ae9c6f49ca93bbe6076ceac0a1fc53d83426c7d7f2d9377e4","evaluation_manifest_hash":"sha256:f5c275befadcaf024e3de1e7f6b472d5fb020df3649d2b1ba9fdb33b3bd493c5","failure_code":null,"genre_intent_hash":"sha256:0541b4476924bb9c43f946041f38c27e303f43a77e77c2e66ad943a0dd6e65d0","hard_checks":[{"evidence":{"evidence_hash":"sha256:48b975b38800cedac1eea2da5f38af2e2efe546f5edf75339d882a0a9e9e7023","inputs":[0],"operator":{"comparator":"ge","kind":"integer_compare","threshold":0},"result":true,"source_bindings":[{"artifact_hash":"sha256:5aefd9201eef332ff9842481dc723b63f62692e98e2310f824e3e3a2603506d7","artifact_kind":"compile_report","json_pointer":"/search_statistics/chord_query_count","schema_hash":"sha256:76aaba56da4739b30ec7f4efab4e0dc31329daeeb184e15503b0a39d73f9c526"}]},"id":"compile_activity_valid","ordinal":0,"passed":true}],"metrics":[{"available_source_bindings":[],"evidence":null,"id":"distinct_sounding_material_lineage_count","missing_reason":null,"ordinal":0,"value":1},{"available_source_bindings":[],"evidence":null,"id":"genre_similarity","missing_reason":null,"ordinal":1,"value":1},{"available_source_bindings":[],"evidence":null,"id":"material_recurrence_distance_q","missing_reason":null,"ordinal":2,"value":2000},{"available_source_bindings":[],"evidence":null,"id":"native_ji_quality","missing_reason":null,"ordinal":3,"value":1},{"available_source_bindings":[],"evidence":null,"id":"negative_program_structural_item_count","missing_reason":null,"ordinal":4,"value":1},{"available_source_bindings":[],"evidence":null,"id":"section_coverage_q","missing_reason":null,"ordinal":5,"value":1},{"available_source_bindings":[],"evidence":null,"id":"sounding_role_count","missing_reason":null,"ordinal":6,"value":1},{"available_source_bindings":[],"evidence":null,"id":"transformed_recall_count","missing_reason":null,"ordinal":7,"value":1},{"available_source_bindings":[],"evidence":null,"id":"rhythmic_syncopation_q","missing_reason":null,"ordinal":8,"value":2000}],"program_hash":"sha256:f3cdea8907e64f783ff769f03186f9d87d357878b38f9518d720ffb9e13a8344","project_hash":"sha256:e469846222268ed3047a204f9b7799674a2646e0ae61b3e0e261ec72f46c593d","report_hash":"sha256:aa0d277bb07bf996b7d3f1f980480def7acdbec92b455ccf08c392dfa53a8469","request_hash":"sha256:fc0f8c934b8e4b4187a57e959249e416ada82cd04590a81dc2ef81ff37b4c670","run_hash":"sha256:acba25512100f80b56fc3ccd14c65be55d94800cda77585c5f41a887e398f9be","schema":"cps.evaluation-report","schema_version":"1.1.0","source_decision_hash":"sha256:75e0b206a1936e8de7cd648c5c45e491ec13a4617f99bf7d398adb2a535c01f7","status":"success"}
