{"context_hash":"sha256:ea7792a26f405e2ae9c6f49ca93bbe6076ceac0a1fc53d83426c7d7f2d9377e4","evaluation_manifest_hash":"sha256:f5c275befadcaf024e3de1e7f6b472d5fb020df3649d2b1ba9fdb33b3bd493c5","failure_code":null,"genre_intent_hash":"sha256:0541b4476924bb9c43f946041f38c27e303f43a77e77c2e66ad943a0dd6e65d0","hard_checks":[{"evidence":{"evidence_hash":"sha256:d74e7b3a48dd7c3f6c8f71d4ae8706603f9662778aa093087feb18fbd7c9c09d","inputs":[0],"operator":{"comparator":"ge","kind":"integer_compare","threshold":0},"result":true,"source_bindings":[{"artifact_hash":"sha256:4e804eeea66f2372d38722f30c7c072a97d335399b0437d307c2a6a58406f009","artifact_kind":"compile_report","json_pointer":"/search_statistics/chord_query_count","schema_hash":"sha256:76aaba56da4739b30ec7f4efab4e0dc31329daeeb184e15503b0a39d73f9c526"}]},"id":"compile_activity_valid","ordinal":0,"passed":true}],"metrics":[{"available_source_bindings":[],"evidence":null,"id":"distinct_sounding_material_lineage_count","missing_reason":null,"ordinal":0,"value":1},{"available_source_bindings":[],"evidence":null,"id":"genre_similarity","missing_reason":null,"ordinal":1,"value":1},{"available_source_bindings":[],"evidence":null,"id":"material_recurrence_distance_q","missing_reason":null,"ordinal":2,"value":2000},{"available_source_bindings":[],"evidence":null,"id":"native_ji_quality","missing_reason":null,"ordinal":3,"value":1},{"available_source_bindings":[],"evidence":null,"id":"negative_program_structural_item_count","missing_reason":null,"ordinal":4,"value":1},{"available_source_bindings":[],"evidence":null,"id":"section_coverage_q","missing_reason":null,"ordinal":5,"value":1},{"available_source_bindings":[],"evidence":null,"id":"sounding_role_count","missing_reason":null,"ordinal":6,"value":1},{"available_source_bindings":[],"evidence":null,"id":"transformed_recall_count","missing_reason":null,"ordinal":7,"value":1},{"available_source_bindings":[],"evidence":null,"id":"rhythmic_syncopation_q","missing_reason":null,"ordinal":8,"value":2000}],"program_hash":"sha256:9bae430f615e334d733d26d01c5d0453719b9436a93178869f6a451265523ba9","project_hash":"sha256:4145bbe2ea582701b2dd4c7f09353a97dd75356650ab8474b7b561e002d2fdad","report_hash":"sha256:f79e522cea0ee17bb6e96abd1ad63bfcdedd638f62524b20f96891e64cd5b316","request_hash":"sha256:7821cf2075cfe3430bc997c7b028bd1fa49a5300a72dd6c417885feaaa38c37e","run_hash":"sha256:acba25512100f80b56fc3ccd14c65be55d94800cda77585c5f41a887e398f9be","schema":"cps.evaluation-report","schema_version":"1.1.0","source_decision_hash":"sha256:128da412b21de31e7b6f370cb3e79679f832e28a931c65be07ac7c03afebe96c","status":"success"}
