{"context_hash":"sha256:ea7792a26f405e2ae9c6f49ca93bbe6076ceac0a1fc53d83426c7d7f2d9377e4","evaluation_manifest_hash":"sha256:f5c275befadcaf024e3de1e7f6b472d5fb020df3649d2b1ba9fdb33b3bd493c5","failure_code":null,"genre_intent_hash":"sha256:0541b4476924bb9c43f946041f38c27e303f43a77e77c2e66ad943a0dd6e65d0","hard_checks":[{"evidence":{"evidence_hash":"sha256:0bf9348e29fc4340546d0bb9487595a410e5ee32e89fb69d014d60380af238cc","inputs":[0],"operator":{"comparator":"ge","kind":"integer_compare","threshold":0},"result":true,"source_bindings":[{"artifact_hash":"sha256:533b6925fc6f48f844e5f9759f5353e1118036964792c66387249f0e2f8bb6ba","artifact_kind":"compile_report","json_pointer":"/search_statistics/chord_query_count","schema_hash":"sha256:76aaba56da4739b30ec7f4efab4e0dc31329daeeb184e15503b0a39d73f9c526"}]},"id":"compile_activity_valid","ordinal":0,"passed":true}],"metrics":[{"available_source_bindings":[],"evidence":null,"id":"distinct_sounding_material_lineage_count","missing_reason":null,"ordinal":0,"value":1},{"available_source_bindings":[],"evidence":null,"id":"genre_similarity","missing_reason":null,"ordinal":1,"value":1},{"available_source_bindings":[],"evidence":null,"id":"material_recurrence_distance_q","missing_reason":null,"ordinal":2,"value":4000},{"available_source_bindings":[],"evidence":null,"id":"native_ji_quality","missing_reason":null,"ordinal":3,"value":1},{"available_source_bindings":[],"evidence":null,"id":"negative_program_structural_item_count","missing_reason":null,"ordinal":4,"value":1},{"available_source_bindings":[],"evidence":null,"id":"section_coverage_q","missing_reason":null,"ordinal":5,"value":1},{"available_source_bindings":[],"evidence":null,"id":"sounding_role_count","missing_reason":null,"ordinal":6,"value":1},{"available_source_bindings":[],"evidence":null,"id":"transformed_recall_count","missing_reason":null,"ordinal":7,"value":1},{"available_source_bindings":[],"evidence":null,"id":"rhythmic_syncopation_q","missing_reason":null,"ordinal":8,"value":8000}],"program_hash":"sha256:b256eab775bb2f05b845849ee8164d2a5c439df5c066cc7b9e9fd665cbc8330b","project_hash":"sha256:4f02511a499b72f4935340387f6a266672a4f8385129b3f6502b341f2801c311","report_hash":"sha256:716cd21610b914fcea29c82817a8f11a441e3becff9b7e70595e713a42f00f97","request_hash":"sha256:3f80ea1af592311b8ba29b754363207163928f1a67d4c7a8eab1cb1e28aa2fa6","run_hash":"sha256:acba25512100f80b56fc3ccd14c65be55d94800cda77585c5f41a887e398f9be","schema":"cps.evaluation-report","schema_version":"1.1.0","source_decision_hash":"sha256:dc59643fecb3bf037b0f0d488d165c32ae87b0b1654ce34eef0397cc670b40d3","status":"success"}
