{"context_hash":"sha256:ea7792a26f405e2ae9c6f49ca93bbe6076ceac0a1fc53d83426c7d7f2d9377e4","evaluation_manifest_hash":"sha256:f5c275befadcaf024e3de1e7f6b472d5fb020df3649d2b1ba9fdb33b3bd493c5","failure_code":null,"genre_intent_hash":"sha256:0541b4476924bb9c43f946041f38c27e303f43a77e77c2e66ad943a0dd6e65d0","hard_checks":[{"evidence":{"evidence_hash":"sha256:27a966b80ec6bbe976004e99b6968d86ebb86c29329da8aa609ab4677034fa35","inputs":[0],"operator":{"comparator":"ge","kind":"integer_compare","threshold":0},"result":false,"source_bindings":[{"artifact_hash":"sha256:afc4a718ebebed54c12e017eac81dc3668a390c058e4d812391b3bb053ee0062","artifact_kind":"compile_report","json_pointer":"/search_statistics/chord_query_count","schema_hash":"sha256:76aaba56da4739b30ec7f4efab4e0dc31329daeeb184e15503b0a39d73f9c526"}]},"id":"compile_activity_valid","ordinal":0,"passed":false}],"metrics":[{"available_source_bindings":[],"evidence":null,"id":"distinct_sounding_material_lineage_count","missing_reason":null,"ordinal":0,"value":1},{"available_source_bindings":[],"evidence":null,"id":"genre_similarity","missing_reason":null,"ordinal":1,"value":1},{"available_source_bindings":[],"evidence":null,"id":"material_recurrence_distance_q","missing_reason":null,"ordinal":2,"value":8000},{"available_source_bindings":[],"evidence":null,"id":"native_ji_quality","missing_reason":null,"ordinal":3,"value":1},{"available_source_bindings":[],"evidence":null,"id":"negative_program_structural_item_count","missing_reason":null,"ordinal":4,"value":1},{"available_source_bindings":[],"evidence":null,"id":"section_coverage_q","missing_reason":null,"ordinal":5,"value":1},{"available_source_bindings":[],"evidence":null,"id":"sounding_role_count","missing_reason":null,"ordinal":6,"value":1},{"available_source_bindings":[],"evidence":null,"id":"transformed_recall_count","missing_reason":null,"ordinal":7,"value":0},{"available_source_bindings":[],"evidence":null,"id":"rhythmic_syncopation_q","missing_reason":null,"ordinal":8,"value":4000}],"program_hash":"sha256:92d7f58b80557616501c5259ac83d8234748570dfc13827a610b9b4340fb3421","project_hash":"sha256:8c8a85e3dfeeb502fe758e64f1a64ee23c57555fa36136bb2cf2c6615a7db8f9","report_hash":"sha256:2bb961caa537d4a7b84e98f2bcce817062e531ad0f5142bf0b14b8ba59235cd5","request_hash":"sha256:32785847326c2711e58a059f89ea37021331981e3887352f1c3b54275580a0cf","run_hash":"sha256:acba25512100f80b56fc3ccd14c65be55d94800cda77585c5f41a887e398f9be","schema":"cps.evaluation-report","schema_version":"1.1.0","source_decision_hash":"sha256:69b8a275e61a4ca827268a6081ca133cdbe096d103cc6e21f8e9d0db1e59975f","status":"success"}
